{
  "id" : "psk:cat06",
  "name" : {
    "en" : "Sarta"
  },
  "species" : "cat",
  "personality" : [ "uchi" ],
  "personalitySubtype" : 0,
  "gender" : "fem",
  "attraction" : "both",
  "birthday" : [ 13, 10 ],
  "hobby" : "music",
  "colors" : [ "purple", "blue" ],
  "nameTag" : [ "#FFFFFF", "#848484" ],
  "catchphrase" : {
    "en" : "zipper"
  },
  "clothing" : {
    "default" : "acnh:heartsweater/red",
    "rain" : [ "acnh:raincoat/blue", "acnh:rainhat/blue" ]
  },
  "umbrella" : "acnh:blackchicumbrella",
  "photo" : "psk:sartasphoto",
  "poster" : "psk:sartasposter",
  "house" : {
    "walls" : "acnh:purplerosewall",
    "floor" : "acnh:simpleblueflooring",
    "music" : "acnh:kksonata",
    "items" : [
      "acnh:antiqueminitable",
      "acnh:antiqueconsoletable",
      "acnh:pianobench/1",
      "acnh:antiqueclock",
      "acnh:rattanlowtable/3",
      "acnh:doublesofa/4",
      "acnh:fireplace/1",
      "acnh:phonograph/0/2",
      "acnh:grandpiano/1"
    ]
  }
}