{
  "id" : "psk:cat03",
  "name" : {
    "en" : "Bea"
  },
  "species" : "cat",
  "personality" : [ "snooty" ],
  "personalitySubtype" : 0,
  "gender" : "fnb",
  "attraction" : "boys",
  "birthday" : [ 4, 10 ],
  "hobby" : "education",
  "colors" : [ "black", "yellow" ],
  "nameTag" : [ "#FFFFFF", "#848484" ],
  "catchphrase" : {
    "en" : "hyahaha"
  },
  "clothing" : {
    "default" : "acnh:heartsweater/red",
    "rain" : [ "acnh:raincoat/blue", "acnh:rainhat/blue" ]
  },
  "umbrella" : "acnh:redumbrella",
  "photo" : "psk:beasphoto",
  "poster" : "psk:beasposter",
  "house" : {
    "walls" : "acnh:commonwall",
    "floor" : "acnh:commonflooring",
    "music" : "acnh:silence",
    "items" : [
    ]
  }
}