{
  "id" : "psk:cat05",
  "name" : {
    "en" : "Felix"
  },
  "species" : "cat",
  "personality" : [ "jock" ],
  "personalitySubtype" : 0,
  "gender" : "mas",
  "attraction" : "both",
  "birthday" : [ 25, 11 ],
  "hobby" : "music",
  "colors" : [ "red", "purple" ],
  "nameTag" : [ "#FFFFFF", "#848484" ],
  "catchphrase" : {
    "en" : "excellent"
  },
  "clothing" : {
    "default" : "acnh:heartsweater/red",
    "rain" : [ "acnh:raincoat/blue", "acnh:rainhat/blue" ]
  },
  "umbrella" : "acnh:blackchicumbrella",
  "photo" : "psk:felixsphoto",
  "poster" : "psk:felixsposter",
  "house" : {
    "walls" : "acnh:purplerosewall",
    "floor" : "acnh:simpleblueflooring",
    "music" : "acnh:kksonata",
    "items" : [
      "acnh:antiqueminitable",
      "acnh:antiqueconsoletable",
      "acnh:pianobench/1",
      "acnh:antiqueclock",
      "acnh:rattanlowtable/3",
      "acnh:doublesofa/4",
      "acnh:fireplace/1",
      "acnh:phonograph/0/2",
      "acnh:grandpiano/1"
    ]
  }
}