{
  "id" : "psk:cat11",
  "name" : {
    "en" : "Rockie"
  },
  "species" : "cat",
  "personality" : [ "peppy" ],
  "personalitySubtype" : 0,
  "gender" : "fem",
  "attraction" : "both",
  "birthday" : [ 9, 6 ],
  "hobby" : "music",
  "colors" : [ "pink", "yellow" ],
  "nameTag" : [ "#FFFFFF", "#848484" ],
  "catchphrase" : {
    "en" : "kakeen~"
  },
  "clothing" : {
    "default" : "acnh:heartsweater/red",
    "rain" : [ "acnh:raincoat/blue", "acnh:rainhat/blue" ]
  },
  "umbrella" : "acnh:blackchicumbrella",
  "photo" : "psk:velvetsphoto",
  "poster" : "psk:velvetsposter",
  "house" : {
    "walls" : "acnh:purplerosewall",
    "floor" : "acnh:simpleblueflooring",
    "music" : "acnh:kksonata",
    "items" : [
      "acnh:antiqueminitable",
      "acnh:antiqueconsoletable",
      "acnh:pianobench/1",
      "acnh:antiqueclock",
      "acnh:rattanlowtable/3",
      "acnh:doublesofa/4",
      "acnh:fireplace/1",
      "acnh:phonograph/0/2",
      "acnh:grandpiano/1"
    ]
  }
}