{
  "id" : "fnaf:fnaf01",
  "name" : {
    "en" : "Bonnie"
  },
  "species" : "rbt",
  "personality" : [ "plain" ],
  "personalitySubtype" : 0,
  "gender" : "boy",
  "attraction" : "none",
  "birthday" : [ 1, 1 ],
  "hobby" : "music",
  "colors" : [ "blue", "purple" ],
  "nameTag" : [ "#FFFFFF", "#848484" ],
  "catchphrase" : {
    "en" : "superstar"
  },
  "clothing" : {
    "default" : "acnh:heartsweater/red",
    "rain" : [ "acnh:raincoat/blue", "acnh:rainhat/blue" ]
  },
  "umbrella" : "acnh:redumbrella",
  "photo" : "fnaf:bonniesphoto",
  "poster" : "fnaf:bonniesposter",
  "house" : {
    "walls" : "acnh:commonwall",
    "floor" : "acnh:commonflooring",
    "music" : "acnh:silence",
    "items" : [
    ]
  }
}