{
  "id" : "psk:cat03",
  "name" : {
    "en" : "Meiki"
  },
  "species" : "cat",
  "personality" : [ "normal" ],
  "personalitySubtype" : 0,
  "gender" : "fnb",
  "attraction" : "none",
  "birthday" : [ 22, 7 ],
  "hobby" : "play",
  "colors" : [ "white", "yellow" ],
  "nameTag" : [ "#AA6405", "#FFF7CF" ],
  "catchphrase" : {
    "en" : "I think"
  },
  "clothing" : {
    "default" : "acnh:heartsweater/red",
    "rain" : [ "acnh:raincoat/blue", "acnh:rainhat/blue" ]
  },
  "umbrella" : "acnh:blackchicumbrella",
  "photo" : "psk:meikisphoto",
  "poster" : "psk:meikisposter",
  "house" : {
    "walls" : "acnh:purplerosewall",
    "floor" : "acnh:simpleblueflooring",
    "music" : "acnh:kksonata",
    "items" : [
      "acnh:antiqueminitable",
      "acnh:antiqueconsoletable",
      "acnh:pianobench/1",
      "acnh:antiqueclock",
      "acnh:rattanlowtable/3",
      "acnh:doublesofa/4",
      "acnh:fireplace/1",
      "acnh:phonograph/0/2",
      "acnh:grandpiano/1"
    ]
  }
}