{
  "id" : "psk:cat08",
  "name" : {
    "en" : "Semilina"
  },
  "species" : "cat",
  "personality" : [ "uchi" ],
  "personalitySubtype" : 0,
  "gender" : "fem",
  "attraction" : "none",
  "birthday" : [ 2, 7 ],
  "hobby" : "nature",
  "colors" : [ "colorful", "white" ],
  "nameTag" : [ "#FFFFFF", "#848484" ],
  "catchphrase" : {
    "en" : "mrow"
  },
  "clothing" : {
    "default" : "acnh:heartsweater/red",
    "rain" : [ "acnh:raincoat/blue", "acnh:rainhat/blue" ]
  },
  "umbrella" : "acnh:blackchicumbrella",
  "photo" : "psk:semilinasphoto",
  "poster" : "psk:semilinasposter",
  "house" : {
    "walls" : "acnh:purplerosewall",
    "floor" : "acnh:simpleblueflooring",
    "music" : "acnh:kksonata",
    "items" : [
      "acnh:antiqueminitable",
      "acnh:antiqueconsoletable",
      "acnh:pianobench/1",
      "acnh:antiqueclock",
      "acnh:rattanlowtable/3",
      "acnh:doublesofa/4",
      "acnh:fireplace/1",
      "acnh:phonograph/0/2",
      "acnh:grandpiano/1"
    ]
  }
}