{
  "id" : "psk:cat07",
  "name" : {
    "en" : "Socks"
  },
  "species" : "cat",
  "personality" : [ "cranky" ],
  "personalitySubtype" : 0,
  "gender" : "mnb",
  "attraction" : "both",
  "birthday" : [ 21, 12 ],
  "hobby" : "music",
  "colors" : [ "green", "blue" ],
  "nameTag" : [ "#FFFFFF", "#848484" ],
  "catchphrase" : {
    "en" : "y'know dude"
  },
  "clothing" : {
    "default" : "acnh:heartsweater/red",
    "rain" : [ "acnh:raincoat/blue", "acnh:rainhat/blue" ]
  },
  "umbrella" : "acnh:blackchicumbrella",
  "photo" : "psk:socksphoto",
  "poster" : "psk:socksposter",
  "house" : {
    "walls" : "acnh:purplerosewall",
    "floor" : "acnh:simpleblueflooring",
    "music" : "acnh:kksonata",
    "items" : [
      "acnh:antiqueminitable",
      "acnh:antiqueconsoletable",
      "acnh:pianobench/1",
      "acnh:antiqueclock",
      "acnh:rattanlowtable/3",
      "acnh:doublesofa/4",
      "acnh:fireplace/1",
      "acnh:phonograph/0/2",
      "acnh:grandpiano/1"
    ]
  }
}