{
  "id" : "psk:cat02",
  "name" : {
    "en" : "Farrah"
  },
  "species" : "cat",
  "personality" : [ "normal" ],
  "personalitySubtype" : 0,
  "gender" : "fem",
  "attraction" : "both",
  "birthday" : [ 3, 2 ],
  "hobby" : "fitness",
  "colors" : [ "white", "black" ],
  "nameTag" : [ "#FFFFFF", "#848484" ],
  "catchphrase" : {
    "en" : ""
  },
  "clothing" : {
    "default" : "acnh:heartsweater/red",
    "rain" : [ "acnh:raincoat/blue", "acnh:rainhat/blue" ]
  },
  "umbrella" : "acnh:blackchicumbrella",
  "photo" : "acnh:farrahsphoto",
  "poster" : "acnh:farrahsposter",
  "house" : {
    "walls" : "acnh:purplerosewall",
    "floor" : "acnh:simpleblueflooring",
    "music" : "acnh:kksonata",
    "items" : [
      "acnh:antiqueminitable",
      "acnh:antiqueconsoletable",
      "acnh:pianobench/1",
      "acnh:antiqueclock",
      "acnh:rattanlowtable/3",
      "acnh:doublesofa/4",
      "acnh:fireplace/1",
      "acnh:phonograph/0/2",
      "acnh:grandpiano/1"
    ]
  }
}