{
  "id" : "psk:cat01",
  "name" : {
    "en" : "Jasmine",
    "ja" : "ジャスミン",
    "ko" : "재스민",
    "zh" : "茉莉",
    "de" : "Jasmin",
    "ru" : "Жасмин",
    "nl" : "Jasmijn",
    "hu" : "Jázmin"
  },
  "species" : "cat",
  "personality" : [ "horny", "uchi" ],
  "personalitySubtype" : 0,
  "gender" : "girl",
  "attraction" : "both",
  "birthday" : [ 1, 1 ],
  "hobby" : "music",
  "colors" : [ "white", "black" ],
  "nameTag" : [ "#FFFFFF", "#848484" ],
  "catchphrase" : {
    "en" : "mmmmrr",
    "ja" : "うーん",
    "ru" : "ммммрр"
  },
  "clothing" : {
    "default" : "acnh:heartsweater/red",
    "rain" : [ "acnh:raincoat/blue", "acnh:rainhat/blue" ]
  },
  "umbrella" : "acnh:redumbrella",
  "photo" : "psk:jasminesphoto",
  "poster" : "psk:jasminesposter",
  "house" : {
    "walls" : "acnh:commonwall",
    "floor" : "acnh:commonflooring",
    "music" : "acnh:silence",
    "items" : [
    ]
  }
}