{
  "id" : "psk:cat04",
  "name" : {
    "en" : "Bea"
  },
  "species" : "cat",
  "personality" : [ "snooty" ],
  "personalitySubtype" : 0,
  "gender" : "fnb",
  "attraction" : "boys",
  "birthday" : [ 4, 10 ],
  "hobby" : "education",
  "colors" : [ "black", "yellow" ],
  "nameTag" : [ "#FFFFFF", "#848484" ],
  "catchphrase" : {
    "en" : "hyahaha"
  },
  "clothing" : {
    "default" : "acnh:heartsweater/red",
    "rain" : [ "acnh:raincoat/blue", "acnh:rainhat/blue" ]
  },
  "umbrella" : "acnh:blackchicumbrella",
  "photo" : "psk:beasphoto",
  "poster" : "psk:beasposter",
  "house" : {
    "walls" : "acnh:purplerosewall",
    "floor" : "acnh:simpleblueflooring",
    "music" : "acnh:kksonata",
    "items" : [
      "acnh:antiqueminitable",
      "acnh:antiqueconsoletable",
      "acnh:pianobench/1",
      "acnh:antiqueclock",
      "acnh:rattanlowtable/3",
      "acnh:doublesofa/4",
      "acnh:fireplace/1",
      "acnh:phonograph/0/2",
      "acnh:grandpiano/1"
    ]
  }
}